{
  "_D": "urn:oasis:names:specification:ubl:schema:xsd:TradeItemLocationProfile-2",
  "_A": "urn:oasis:names:specification:ubl:schema:xsd:CommonAggregateComponents-2",
  "_B": "urn:oasis:names:specification:ubl:schema:xsd:CommonBasicComponents-2",
  "TradeItemLocationProfile": {
    "UBLVersionID": { "_": "2.1" },
    "ProfileID": {
      "_": "bpid:urn:oasis:names:draft:bpss:ubl-2-1-cpfr-trade-item-location-profile"
    },
    "ID": { "_": "TILP758494" },
    "CopyIndicator": { "_": false },
    "UUID": { "_": "349ABBAE-DF9D-40B4-849F-94C5FF9D1AF4" },
    "IssueDate": { "_": "2005-01-10" },
    "IssueTime": { "_": "12:00:01.000Z" },
    "Note": [{ "_": "sample" }],
    "ProfileStatusCode": { "_": "NEW" },
    "Period": {
      "StartDate": { "_": "2005-02-26" },
      "EndDate": { "_": "2005-12-26" }
    },
    "SenderParty": {
      "PartyIdentification": [
        {
          "ID": { "_": "6903148000007" }
        }
      ],
      "PartyName": [
        {
          "Name": { "_": "Consortial" }
        }
      ],
      "PostalAddress": {
        "StreetName": { "_": "Busy Street" },
        "BuildingName": { "_": "Thereabouts" },
        "BuildingNumber": { "_": "56A" },
        "CityName": { "_": "Farthing" },
        "PostalZone": { "_": "AA99 1BB" },
        "CountrySubentity": { "_": "Heremouthshire" },
        "AddressLine": [
          {
            "Line": { "_": "The Roundabout" }
          }
        ],
        "Country": {
          "IdentificationCode": { "_": "GB" }
        }
      },
      "PartyTaxScheme": [
        {
          "RegistrationName": { "_": "Farthing Purchasing Consortium" },
          "CompanyID": { "_": "175 269 2355" },
          "ExemptionReason": [{ "_": "N/A" }],
          "TaxScheme": {
            "ID": { "_": "VAT" },
            "TaxTypeCode": { "_": "VAT" }
          }
        }
      ],
      "Contact": {
        "Name": { "_": "Mrs Bouquet" },
        "Telephone": { "_": "0158 1233714" },
        "Telefax": { "_": "0158 1233856" },
        "ElectronicMail": { "_": "bouquet@fpconsortial.co.uk" }
      }
    },
    "ReceiverParty": {
      "PartyIdentification": [
        {
          "ID": { "_": "2203148000007" }
        }
      ],
      "PartyName": [
        {
          "Name": { "_": "IYT Corporation" }
        }
      ],
      "PostalAddress": {
        "StreetName": { "_": "Avon Way" },
        "BuildingName": { "_": "Thereabouts" },
        "BuildingNumber": { "_": "56A" },
        "CityName": { "_": "Bridgtow" },
        "PostalZone": { "_": "ZZ99 1ZZ" },
        "CountrySubentity": { "_": "Avon" },
        "AddressLine": [
          {
            "Line": { "_": "3rd Floor, Room 5" }
          }
        ],
        "Country": {
          "IdentificationCode": { "_": "GB" }
        }
      },
      "PartyTaxScheme": [
        {
          "RegistrationName": { "_": "Bridgtow District Council" },
          "CompanyID": { "_": "12356478" },
          "ExemptionReason": [{ "_": "Local Authority" }],
          "TaxScheme": {
            "ID": { "_": "UK VAT" },
            "TaxTypeCode": { "_": "VAT" }
          }
        }
      ],
      "Contact": {
        "Name": { "_": "Mr Fred Churchill" },
        "Telephone": { "_": "0127 2653214" },
        "Telefax": { "_": "0127 2653215" },
        "ElectronicMail": { "_": "fred@iytcorporation.gov.uk" }
      }
    },
    "BuyerCustomerParty": {
      "Party": {
        "PartyIdentification": [
          {
            "ID": { "_": "0012345000359" }
          }
        ]
      }
    },
    "SellerSupplierParty": {
      "Party": {
        "PartyIdentification": [
          {
            "ID": { "_": "0012345000058" }
          }
        ]
      }
    },
    "ItemManagementProfile": [
      {
        "FrozenPeriodDaysNumeric": { "_": 3 },
        "MinimumInventoryQuantity": { "_": 8 },
        "MultipleOrderQuantity": { "_": 1 },
        "OrderIntervalDaysNumeric": { "_": 3 },
        "ReplenishmentOwnerDescription": [{ "_": "Ownere-321" }],
        "TargetServicePercent": { "_": 1 },
        "TargetInventoryQuantity": { "_": 20, "unitCode": "KGM" },
        "EffectivePeriod": {
          "StartDate": { "_": "2005-02-26" },
          "EndDate": { "_": "2005-12-26" }
        },
        "Item": {
          "Description": [{ "_": "Acme beeswax" }],
          "Name": { "_": "beeswax" },
          "BuyersItemIdentification": {
            "ID": { "_": "6578489" }
          },
          "SellersItemIdentification": {
            "ID": { "_": "17589683" }
          },
          "StandardItemIdentification": {
            "ID": { "_": "00123450000584" }
          }
        },
        "ItemLocationQuantity": {
          "LeadTimeMeasure": { "_": 3, "unitCode": "DAY" },
          "MinimumQuantity": { "_": 2 }
        }
      }
    ]
  }
}
